product_page_urls,title,upc,prices_inc_tax,prices_ex_tax,nb_available,rating,product description,image,category
http://books.toscrape.com/catalogue/sharp-objects_997/index.html,Sharp Objects,e00eb4fd7b871a48,£47.82,£47.82,In stock (20 available),star-rating Four,"WICKED above her hipbone, GIRL across her heart Words are like a road map to reporter Camille Preaker’s troubled past. Fresh from a brief stay at a psych hospital, Camille’s first assignment from the second-rate daily paper where she works brings her reluctantly back to her hometown to cover the murders of two preteen girls. NASTY on her kneecap, BABYDOLL on her leg Since WICKED above her hipbone, GIRL across her heart Words are like a road map to reporter Camille Preaker’s troubled past. Fresh from a brief stay at a psych hospital, Camille’s first assignment from the second-rate daily paper where she works brings her reluctantly back to her hometown to cover the murders of two preteen girls. NASTY on her kneecap, BABYDOLL on her leg Since she left town eight years ago, Camille has hardly spoken to her neurotic, hypochondriac mother or to the half-sister she barely knows: a beautiful thirteen-year-old with an eerie grip on the town. Now, installed again in her family’s Victorian mansion, Camille is haunted by the childhood tragedy she has spent her whole life trying to cut from her memory. HARMFUL on her wrist, WHORE on her ankle As Camille works to uncover the truth about these violent crimes, she finds herself identifying with the young victims—a bit too strongly. Clues keep leading to dead ends, forcing Camille to unravel the psychological puzzle of her own past to get at the story. Dogged by her own demons, Camille will have to confront what happened to her years before if she wants to survive this homecoming.With its taut, crafted writing, Sharp Objects is addictive, haunting, and unforgettable. ...more",http://books.toscrape.com/media/cache/c0/59/c05972805aa7201171b8fc71a5b00292.jpg,Mystery
http://books.toscrape.com/catalogue/in-a-dark-dark-wood_963/index.html,"In a Dark, Dark Wood",19ed25f4641d5efd,£19.63,£19.63,In stock (18 available),star-rating One,"In a dark, dark wood Nora hasn't seen Clare for ten years. Not since Nora walked out of school one day and never went back. There was a dark, dark houseUntil, out of the blue, an invitation to Clare’s hen do arrives. Is this a chance for Nora to finally put her past behind her?And in the dark, dark house there was a dark, dark roomBut something goes wrong. Very wrong.And i In a dark, dark wood Nora hasn't seen Clare for ten years. Not since Nora walked out of school one day and never went back. There was a dark, dark houseUntil, out of the blue, an invitation to Clare’s hen do arrives. Is this a chance for Nora to finally put her past behind her?And in the dark, dark house there was a dark, dark roomBut something goes wrong. Very wrong.And in the dark, dark room.... Some things can’t stay secret for ever. ...more",http://books.toscrape.com/media/cache/95/84/95840dfd67c020067c99d70451147e20.jpg,Mystery
http://books.toscrape.com/catalogue/the-past-never-ends_942/index.html,The Past Never Ends,5ee94540d0749ea0,£56.50,£56.50,In stock (16 available),star-rating Four,"A simple task, Attorney Chester Morgan thinks. Get a copy of a public record for a young man whose only friend has died in an unexplained accidental death. Except... The police file regarding the demise of sex worker Tanya Everly has been sealed by the order of the chief of police, and no one will talk. Warned to drop the matter, Attorney Morgan knows that if he doesn't sp A simple task, Attorney Chester Morgan thinks. Get a copy of a public record for a young man whose only friend has died in an unexplained accidental death. Except... The police file regarding the demise of sex worker Tanya Everly has been sealed by the order of the chief of police, and no one will talk. Warned to drop the matter, Attorney Morgan knows that if he doesn't speak for the dead young woman, no one will. Haunted by his discovery of the body of a prominent local oilman, Morgan pursues a quest for justice that puts his reputation, career, and life at risk. A journey that takes him into the dark shadows of the sex-for-sale business, into the marble courtrooms of Oklahoma, and into the aching loneliness of his own soul. Set in the American Southwest in the days before 9/11, The Past Never Ends is both a complex murder mystery and a meditation on the self-perpetuating nature of injustice and the ethereal nature of justice itself. ...more",http://books.toscrape.com/media/cache/9d/f2/9df248dcefeaba9eeb519a59b248f72c.jpg,Mystery
http://books.toscrape.com/catalogue/a-murder-in-time_877/index.html,A Murder in Time,f733e8c19d40ec2e,£16.64,£16.64,In stock (16 available),star-rating One,"Beautiful and brilliant, Kendra Donovan is a rising star at the FBI. Yet her path to professional success hits a speed bump during a disastrous raid where half her team is murdered, a mole in the FBI is uncovered and she herself is severely wounded. As soon as she recovers, she goes rogue and travels to England to assassinate the man responsible for the deaths of her teamm Beautiful and brilliant, Kendra Donovan is a rising star at the FBI. Yet her path to professional success hits a speed bump during a disastrous raid where half her team is murdered, a mole in the FBI is uncovered and she herself is severely wounded. As soon as she recovers, she goes rogue and travels to England to assassinate the man responsible for the deaths of her teammates.While fleeing from an unexpected assassin herself, Kendra escapes into a stairwell that promises sanctuary but when she stumbles out again, she is in the same place - Aldrich Castle - but in a different time: 1815, to be exact.Mistaken for a lady's maid hired to help with weekend guests, Kendra is forced to quickly adapt to the time period until she can figure out how she got there; and, more importantly, how to get back home. However, after the body of a young girl is found on the extensive grounds of the county estate, she starts to feel there's some purpose to her bizarre circumstances. Stripped of her twenty-first century tools, Kendra must use her wits alone in order to unmask a cunning madman. ...more",http://books.toscrape.com/media/cache/cc/bd/ccbd7a62caefd5a3a2e04dd7c2ff48fe.jpg,Mystery
http://books.toscrape.com/catalogue/the-murder-of-roger-ackroyd-hercule-poirot-4_852/index.html,The Murder of Roger Ackroyd (Hercule Poirot #4),c7b5183f4d1d4efe,£44.10,£44.10,In stock (15 available),star-rating Four,"In the village of King's Abbot, a widow's sudden suicide sparks rumors that she murdered her first husband, was being blackmailed, and was carrying on a secret affair with the wealthy Roger Ackroyd. The following evening, Ackroyd is murdered in his locked study--but not before receiving a letter identifying the widow's blackmailer. King's Abbot is crawling with suspects, i In the village of King's Abbot, a widow's sudden suicide sparks rumors that she murdered her first husband, was being blackmailed, and was carrying on a secret affair with the wealthy Roger Ackroyd. The following evening, Ackroyd is murdered in his locked study--but not before receiving a letter identifying the widow's blackmailer. King's Abbot is crawling with suspects, including a nervous butler, Ackroyd's wayward stepson, and his sister-in-law, Mrs. Cecil Ackroyd, who has taken up residence in the victim's home. It's now up to the famous detective Hercule Poirot, who has retired to King's Abbot to garden, to solve the case of who killed Roger Ackroyd--a task in which he is aided by the village doctor and narrator, James Sheppard, and by Sheppard's ingenious sister, Caroline.The Murder of Roger Ackroyd is the book that made Agatha Christie a household name and launched her career as a perennial bestseller. Originally published in 1926, it is a landmark in the mystery genre. It was in the vanguard of a new class of popular detective fiction that ushered in the modern era of mystery novels. ...more",http://books.toscrape.com/media/cache/86/38/8638ba095b3b32e0abdef170e7bc4fd6.jpg,Mystery
http://books.toscrape.com/catalogue/the-last-mile-amos-decker-2_754/index.html,The Last Mile (Amos Decker #2),3bc89353f7e3a3cc,£54.21,£54.21,In stock (14 available),star-rating Two,"In his #1 New York Times bestseller Memory Man, David Baldacci introduced the extraordinary detective Amos Decker-the man who can forget nothing. Now, Decker returns in a spectacular new thriller . . . THE LAST MILEConvicted murderer Melvin Mars is counting down the last hours before his execution--for the violent killing of his parents twenty years earlier--when he's gran In his #1 New York Times bestseller Memory Man, David Baldacci introduced the extraordinary detective Amos Decker-the man who can forget nothing. Now, Decker returns in a spectacular new thriller . . . THE LAST MILEConvicted murderer Melvin Mars is counting down the last hours before his execution--for the violent killing of his parents twenty years earlier--when he's granted an unexpected reprieve. Another man has confessed to the crime.Amos Decker, newly hired on an FBI special task force, takes an interest in Mars's case after discovering the striking similarities to his own life: Both men were talented football players with promising careers cut short by tragedy. Both men's families were brutally murdered. And in both cases, another suspect came forward, years after the killing, to confess to the crime. A suspect who may or may not have been telling the truth.The confession has the potential to make Melvin Mars--guilty or not--a free man. Who wants Mars out of prison? And why now?But when a member of Decker's team disappears, it becomes clear that something much larger--and more sinister--than just one convicted criminal's life hangs in the balance. Decker will need all of his extraordinary brainpower to stop an innocent man from being executed. ...more",http://books.toscrape.com/media/cache/e6/dc/e6dcc8f75214eb14edc1ce09c98f3d71.jpg,Mystery
http://books.toscrape.com/catalogue/that-darkness-gardiner-and-renner-1_743/index.html,That Darkness (Gardiner and Renner #1),0c7b9cf2b7662b65,£13.92,£13.92,In stock (14 available),star-rating One,"As a forensic investigator for the Cleveland Police Department, Maggie Gardiner has seen her share of Jane Does. The latest is an unidentified female in her early teens, discovered in a local cemetery. More shocking than the girl’s injuries—for Maggie at least—is the fact that no one has reported her missing. She and the detectives assigned to the case (including her cop e As a forensic investigator for the Cleveland Police Department, Maggie Gardiner has seen her share of Jane Does. The latest is an unidentified female in her early teens, discovered in a local cemetery. More shocking than the girl’s injuries—for Maggie at least—is the fact that no one has reported her missing. She and the detectives assigned to the case (including her cop ex-husband) are determined to follow every lead, run down every scrap of evidence. But the monster they seek is watching each move, closer to them than they could ever imagine. Jack Renner is a killer. He doesn’t murder because he savors it, or because he believes himself omnipotent, or for any reason other than to make the world a safer place. When he follows the trail of this Jane Doe to a locked room in a small apartment where eighteen teenaged girls are anything but safe, he knows something must be done. But his pursuit of their captor takes an unexpected turn.Maggie Gardiner finds another body waiting for her in the autopsy room—and a host of questions that will challenge everything she believes about justice, morality, and the true nature of evil … ...more",http://books.toscrape.com/media/cache/23/b8/23b81994234ac127d701db1531a08e48.jpg,Mystery
